{
  "generatedAt": "2026-05-31T09:00:23.551Z",
  "$schema": "./PUBLIC-RESULTS.schema.json",
  "schemaVersion": 1,
  "generator": "benchmarks/generate-public-results.mjs",
  "benchmark": "remem-context-window-suite-v1",
  "claimBoundary": {
    "summary": "Synthetic fixed-window stress test measuring retrieval of facts deliberately placed outside a simulated active context window.",
    "safeShortClaim": "ReMEM does not make the model's native context window bigger. It gives agents a searchable external memory layer, letting them work over far more history than fits in the prompt.",
    "notSafeToClaim": [
      "ReMEM gives any model infinite context.",
      "100% semantic recall at millions of tokens.",
      "Production latency is 26ms.",
      "Natural-language retrieval works without embeddings."
    ]
  },
  "harness": {
    "script": "benchmarks/context-window-suite.mjs",
    "storage": "in-memory sql.js via ReMEM storage: 'memory'",
    "seed": 1337,
    "metrics": [
      "fixed recall@1",
      "ReMEM recall@1",
      "ReMEM recall@K",
      "MRR",
      "store time",
      "average/p50/p95 query latency"
    ]
  },
  "historicalBaseline": {
    "releasedAt": "2026-05-03",
    "runs": {
      "memories2000": {
        "sourceFile": "benchmarks/results/context-window-2026-05-03T14-52-06-069Z-2000m-120q.json",
        "sourceSha256": "829a0fa7e463e22032dd2b8c2ca756aba1feb74cef9b8bba6ff6a903149211cc",
        "contextPressure": {
          "corpusApproxTokens": 143650,
          "fixedWindowApproxTokens": 7214,
          "effectiveCorpusToWindowMultiple": 19.91
        },
        "queryCount": 120,
        "scenarios": [
          {
            "name": "core exact codename",
            "label": "Exact codename",
            "sourceFile": "benchmarks/results/context-window-2026-05-03T14-52-06-069Z-2000m-120q.json",
            "sourceSha256": "829a0fa7e463e22032dd2b8c2ca756aba1feb74cef9b8bba6ff6a903149211cc",
            "queryStyle": "exact-code",
            "queryTopics": false,
            "embeddings": false,
            "metrics": {
              "fixedContextRecallAt1": 0,
              "rememRecallAt1": 1,
              "rememRecallAtK": 1,
              "rememMRR": 1,
              "avgReturned": 1.01,
              "storeMs": 188.12,
              "avgStoreMsPerMemory": 0.09,
              "storeFailures": 0,
              "avgQueryMs": 1.94,
              "p50QueryMs": 1.97,
              "p95QueryMs": 2.49
            }
          },
          {
            "name": "core natural language no embeddings",
            "label": "Natural language, no embeddings",
            "sourceFile": "benchmarks/results/context-window-2026-05-03T14-52-06-069Z-2000m-120q.json",
            "sourceSha256": "829a0fa7e463e22032dd2b8c2ca756aba1feb74cef9b8bba6ff6a903149211cc",
            "queryStyle": "natural",
            "queryTopics": false,
            "embeddings": false,
            "metrics": {
              "fixedContextRecallAt1": 0,
              "rememRecallAt1": 0,
              "rememRecallAtK": 0,
              "rememMRR": 0,
              "avgReturned": 0,
              "storeMs": 138.12,
              "avgStoreMsPerMemory": 0.07,
              "storeFailures": 0,
              "avgQueryMs": 1.46,
              "p50QueryMs": 1.43,
              "p95QueryMs": 1.59
            }
          },
          {
            "name": "core topic-filtered exact id",
            "label": "Topic-filtered exact ID",
            "sourceFile": "benchmarks/results/context-window-2026-05-03T14-52-06-069Z-2000m-120q.json",
            "sourceSha256": "829a0fa7e463e22032dd2b8c2ca756aba1feb74cef9b8bba6ff6a903149211cc",
            "queryStyle": "exact-id",
            "queryTopics": true,
            "embeddings": false,
            "metrics": {
              "fixedContextRecallAt1": 0,
              "rememRecallAt1": 0.9083,
              "rememRecallAtK": 0.9083,
              "rememMRR": 0.9083,
              "avgReturned": 1.37,
              "storeMs": 135.51,
              "avgStoreMsPerMemory": 0.07,
              "storeFailures": 0,
              "avgQueryMs": 1.61,
              "p50QueryMs": 1.57,
              "p95QueryMs": 1.77
            }
          }
        ]
      },
      "memories10000": {
        "sourceFile": "benchmarks/results/context-window-2026-05-03T14-52-32-122Z-10000m-250q.json",
        "sourceSha256": "a5ece962aece5a337cd21448bdea726f83334b5b4bd67cebed6b036da376d82e",
        "contextPressure": {
          "corpusApproxTokens": 720631,
          "fixedWindowApproxTokens": 7214,
          "effectiveCorpusToWindowMultiple": 99.9
        },
        "queryCount": 250,
        "scenarios": [
          {
            "name": "core exact codename",
            "label": "Exact codename",
            "sourceFile": "benchmarks/results/context-window-2026-05-03T14-52-32-122Z-10000m-250q.json",
            "sourceSha256": "a5ece962aece5a337cd21448bdea726f83334b5b4bd67cebed6b036da376d82e",
            "queryStyle": "exact-code",
            "queryTopics": false,
            "embeddings": false,
            "metrics": {
              "fixedContextRecallAt1": 0,
              "rememRecallAt1": 0.992,
              "rememRecallAtK": 1,
              "rememMRR": 0.996,
              "avgReturned": 1.01,
              "storeMs": 708,
              "avgStoreMsPerMemory": 0.07,
              "storeFailures": 0,
              "avgQueryMs": 10,
              "p50QueryMs": 10.57,
              "p95QueryMs": 12.41
            }
          },
          {
            "name": "core natural language no embeddings",
            "label": "Natural language, no embeddings",
            "sourceFile": "benchmarks/results/context-window-2026-05-03T14-52-32-122Z-10000m-250q.json",
            "sourceSha256": "a5ece962aece5a337cd21448bdea726f83334b5b4bd67cebed6b036da376d82e",
            "queryStyle": "natural",
            "queryTopics": false,
            "embeddings": false,
            "metrics": {
              "fixedContextRecallAt1": 0,
              "rememRecallAt1": 0,
              "rememRecallAtK": 0,
              "rememMRR": 0,
              "avgReturned": 0,
              "storeMs": 633.58,
              "avgStoreMsPerMemory": 0.06,
              "storeFailures": 0,
              "avgQueryMs": 8.24,
              "p50QueryMs": 8.21,
              "p95QueryMs": 8.67
            }
          },
          {
            "name": "core topic-filtered exact id",
            "label": "Topic-filtered exact ID",
            "sourceFile": "benchmarks/results/context-window-2026-05-03T14-52-32-122Z-10000m-250q.json",
            "sourceSha256": "a5ece962aece5a337cd21448bdea726f83334b5b4bd67cebed6b036da376d82e",
            "queryStyle": "exact-id",
            "queryTopics": true,
            "embeddings": false,
            "metrics": {
              "fixedContextRecallAt1": 0,
              "rememRecallAt1": 0.896,
              "rememRecallAtK": 0.896,
              "rememMRR": 0.896,
              "avgReturned": 1.42,
              "storeMs": 591.08,
              "avgStoreMsPerMemory": 0.06,
              "storeFailures": 0,
              "avgQueryMs": 8.82,
              "p50QueryMs": 8.78,
              "p95QueryMs": 9.17
            }
          }
        ]
      },
      "memories50000": {
        "sourceFile": "benchmarks/results/context-window-2026-05-03T15-00-07-882Z-50000m-500q.json",
        "sourceSha256": "471ce4b2f5260448834cb02153dc25237c5ebc715a2e354b906ecff7f68c0ae5",
        "contextPressure": {
          "corpusApproxTokens": 3625526,
          "fixedWindowApproxTokens": 7264,
          "effectiveCorpusToWindowMultiple": 499.16
        },
        "queryCount": 500,
        "scenarios": [
          {
            "name": "core exact codename",
            "label": "Exact codename",
            "sourceFile": "benchmarks/results/context-window-2026-05-03T15-00-07-882Z-50000m-500q.json",
            "sourceSha256": "471ce4b2f5260448834cb02153dc25237c5ebc715a2e354b906ecff7f68c0ae5",
            "queryStyle": "exact-code",
            "queryTopics": false,
            "embeddings": false,
            "metrics": {
              "fixedContextRecallAt1": 0,
              "rememRecallAt1": 0.994,
              "rememRecallAtK": 1,
              "rememMRR": 0.997,
              "avgReturned": 1.01,
              "storeMs": 3308.99,
              "avgStoreMsPerMemory": 0.07,
              "storeFailures": 0,
              "avgQueryMs": 49.98,
              "p50QueryMs": 53.11,
              "p95QueryMs": 61.14
            }
          },
          {
            "name": "core natural language no embeddings",
            "label": "Natural language, no embeddings",
            "sourceFile": "benchmarks/results/context-window-2026-05-03T15-00-07-882Z-50000m-500q.json",
            "sourceSha256": "471ce4b2f5260448834cb02153dc25237c5ebc715a2e354b906ecff7f68c0ae5",
            "queryStyle": "natural",
            "queryTopics": false,
            "embeddings": false,
            "metrics": {
              "fixedContextRecallAt1": 0,
              "rememRecallAt1": 0,
              "rememRecallAtK": 0,
              "rememMRR": 0,
              "avgReturned": 0,
              "storeMs": 3156.13,
              "avgStoreMsPerMemory": 0.06,
              "storeFailures": 0,
              "avgQueryMs": 42.21,
              "p50QueryMs": 42.17,
              "p95QueryMs": 42.78
            }
          },
          {
            "name": "core topic-filtered exact id",
            "label": "Topic-filtered exact ID",
            "sourceFile": "benchmarks/results/context-window-2026-05-03T15-00-07-882Z-50000m-500q.json",
            "sourceSha256": "471ce4b2f5260448834cb02153dc25237c5ebc715a2e354b906ecff7f68c0ae5",
            "queryStyle": "exact-id",
            "queryTopics": true,
            "embeddings": false,
            "metrics": {
              "fixedContextRecallAt1": 0,
              "rememRecallAt1": 0.896,